<?xml version="1.0" encoding="UTF-8" ?>
<!--

    ICARUS2 Corpus Modeling Framework
    Copyright (C) 2014-2023 Markus GÃ¤rtner <markus.gaertner@ims.uni-stuttgart.de>

    Licensed under the Apache License, Version 2.0 (the "License");
    you may not use this file except in compliance with the License.
    You may obtain a copy of the License at

        http://www.apache.org/licenses/LICENSE-2.0

    Unless required by applicable law or agreed to in writing, software
    distributed under the License is distributed on an "AS IS" BASIS,
    WITHOUT WARRANTIES OR CONDITIONS OF ANY KIND, either express or implied.
    See the License for the specific language governing permissions and
    limitations under the License.

-->
<!DOCTYPE table>
<its:table xmlns:xsi="http://www.w3.org/2001/XMLSchema-instance" 
	xmlns:its="http://www.ims.uni-stuttgart.de/icarus/xml/schema" 
	xsi:schemaLocation="http://www.ims.uni-stuttgart.de/icarus/xml/schema http://www.ims.uni-stuttgart.de/icarus/xml/schema/tabular-schema.xsd" 
	id="test.tier1.tbl" name="Tier-1 Tabular Format"  groupId="main">
	<its:block layerId="token">	
		<its:separator>WHITESPACES</its:separator>	
		<its:endDelimiter>
			<its:pattern>EMPTY_LINE</its:pattern>
		</its:endDelimiter>
		<its:columns>
			<its:column name="ID" ignore="true"/>
			<its:column name="FORM" layerId="form"/>
			<its:column name="LEMMA" layerId="lemma"/>
		</its:columns>
		<its:component memberType="item" />
	</its:block>
</its:table>